{
  "run_id": "run:sample",
  "provider_ref": "mock-circle-app-kit",
  "chain_id": 5042002,
  "created_at": "2026-01-01T00:00:00.000Z",
  "verifier_ref": "aquaduct-harness",
  "policy_version_ref": "policy:aquaduct-harness-v1",
  "proof_envelope_schema": "https://agentropolis.dev/forge/proof-envelope.v1.json",
  "grants_authority": false,
  "promotion": "REQUIRES_FORGE_AND_AEGIS",
  "summary": {
    "scenarios": 17,
    "passed": 17,
    "failed": 0,
    "proofs": 39
  },
  "matrix": [
    {
      "id": "provider-discovery",
      "capability": "DISCOVERY",
      "checks": [
        {
          "name": "declared-capabilities-known",
          "ok": true,
          "detail": []
        }
      ],
      "proof_ids": [
        "proof:run:sample:001"
      ],
      "status": "PASS"
    },
    {
      "id": "send",
      "capability": "SEND",
      "checks": [
        {
          "name": "quote-pending",
          "ok": true,
          "detail": null
        },
        {
          "name": "execute-settled",
          "ok": true,
          "detail": null
        },
        {
          "name": "recipient-bound",
          "ok": true,
          "detail": null
        },
        {
          "name": "gas-in-usdc",
          "ok": true,
          "detail": null
        },
        {
          "name": "deterministic-finality",
          "ok": true,
          "detail": null
        },
        {
          "name": "balance-delta",
          "ok": true,
          "detail": {
            "before": 1000,
            "after": 975
          }
        },
        {
          "name": "replay-idempotent",
          "ok": true,
          "detail": null
        },
        {
          "name": "replay-no-double-spend",
          "ok": true,
          "detail": null
        }
      ],
      "proof_ids": [
        "proof:run:sample:002",
        "proof:run:sample:003",
        "proof:run:sample:004",
        "proof:run:sample:005",
        "proof:run:sample:006"
      ],
      "status": "PASS"
    },
    {
      "id": "send-dual-usdc",
      "capability": "SEND",
      "checks": [
        {
          "name": "both-interfaces-quoted",
          "ok": true,
          "detail": null
        },
        {
          "name": "normalized-net-amount",
          "ok": true,
          "detail": null
        },
        {
          "name": "interface-bound-in-quote",
          "ok": true,
          "detail": null
        }
      ],
      "proof_ids": [
        "proof:run:sample:007"
      ],
      "status": "PASS"
    },
    {
      "id": "quote-binding",
      "capability": "SEND",
      "checks": [
        {
          "name": "mismatched-quote-refused",
          "ok": true,
          "detail": null
        },
        {
          "name": "expired-quote-refused",
          "ok": true,
          "detail": null
        }
      ],
      "proof_ids": [
        "proof:run:sample:008",
        "proof:run:sample:009"
      ],
      "status": "PASS"
    },
    {
      "id": "signer-unavailable",
      "capability": "SEND",
      "checks": [
        {
          "name": "refused-without-signer",
          "ok": true,
          "detail": null
        }
      ],
      "proof_ids": [
        "proof:run:sample:010"
      ],
      "status": "PASS"
    },
    {
      "id": "bridge",
      "capability": "BRIDGE",
      "checks": [
        {
          "name": "route-quoted",
          "ok": true,
          "detail": null
        },
        {
          "name": "pending-after-burn",
          "ok": true,
          "detail": null
        },
        {
          "name": "pending-after-attest",
          "ok": true,
          "detail": null
        },
        {
          "name": "settled-after-mint",
          "ok": true,
          "detail": null
        },
        {
          "name": "pending-vs-settled-distinct",
          "ok": true,
          "detail": null
        }
      ],
      "proof_ids": [
        "proof:run:sample:011",
        "proof:run:sample:012",
        "proof:run:sample:013",
        "proof:run:sample:014"
      ],
      "status": "PASS"
    },
    {
      "id": "bridge-partial-recovery",
      "capability": "BRIDGE",
      "checks": [
        {
          "name": "partial-failure-observed",
          "ok": true,
          "detail": null
        },
        {
          "name": "restart-refused",
          "ok": true,
          "detail": null
        },
        {
          "name": "resume-continues-from-persisted-state",
          "ok": true,
          "detail": null
        },
        {
          "name": "resume-settles",
          "ok": true,
          "detail": null
        }
      ],
      "proof_ids": [
        "proof:run:sample:015",
        "proof:run:sample:016",
        "proof:run:sample:017"
      ],
      "status": "PASS"
    },
    {
      "id": "swap",
      "capability": "SWAP",
      "checks": [
        {
          "name": "quote-within-slippage",
          "ok": true,
          "detail": null
        },
        {
          "name": "swap-settled",
          "ok": true,
          "detail": null
        }
      ],
      "proof_ids": [
        "proof:run:sample:018",
        "proof:run:sample:019",
        "proof:run:sample:020"
      ],
      "status": "PASS"
    },
    {
      "id": "swap-slippage-breach",
      "capability": "SWAP",
      "checks": [
        {
          "name": "slippage-breach-refused",
          "ok": true,
          "detail": null
        }
      ],
      "proof_ids": [
        "proof:run:sample:021",
        "proof:run:sample:022"
      ],
      "status": "PASS"
    },
    {
      "id": "fee-limit",
      "capability": "BRIDGE",
      "checks": [
        {
          "name": "fee-limit-refused",
          "ok": true,
          "detail": null
        }
      ],
      "proof_ids": [
        "proof:run:sample:023",
        "proof:run:sample:024"
      ],
      "status": "PASS"
    },
    {
      "id": "unified-balance",
      "capability": "UNIFIED_BALANCE",
      "checks": [
        {
          "name": "deposit-settled",
          "ok": true,
          "detail": null
        },
        {
          "name": "unified-balance-reconciles",
          "ok": true,
          "detail": 29.995
        },
        {
          "name": "spend-settled",
          "ok": true,
          "detail": null
        },
        {
          "name": "delegated-authority-bound",
          "ok": true,
          "detail": null
        },
        {
          "name": "overspend-fails",
          "ok": true,
          "detail": null
        }
      ],
      "proof_ids": [
        "proof:run:sample:025",
        "proof:run:sample:026",
        "proof:run:sample:027",
        "proof:run:sample:028"
      ],
      "status": "PASS"
    },
    {
      "id": "onramp",
      "capability": "ONRAMP",
      "checks": [
        {
          "name": "session-or-refusal",
          "ok": true,
          "detail": "SESSION_CREATED"
        },
        {
          "name": "secret-handle-not-secret",
          "ok": true,
          "detail": null
        }
      ],
      "proof_ids": [
        "proof:run:sample:029"
      ],
      "status": "PASS"
    },
    {
      "id": "onramp-missing-key",
      "capability": "ONRAMP",
      "checks": [
        {
          "name": "missing-key-refused",
          "ok": true,
          "detail": null
        }
      ],
      "proof_ids": [
        "proof:run:sample:030"
      ],
      "status": "PASS"
    },
    {
      "id": "earn",
      "capability": "EARN",
      "checks": [
        {
          "name": "preview-pending",
          "ok": true,
          "detail": null
        },
        {
          "name": "deposit-settled",
          "ok": true,
          "detail": null
        },
        {
          "name": "withdraw-settled",
          "ok": true,
          "detail": null
        },
        {
          "name": "position-limit-refused",
          "ok": true,
          "detail": null
        }
      ],
      "proof_ids": [
        "proof:run:sample:031",
        "proof:run:sample:032",
        "proof:run:sample:033",
        "proof:run:sample:034",
        "proof:run:sample:035"
      ],
      "status": "PASS"
    },
    {
      "id": "mainnet-refused",
      "capability": "CHAIN",
      "checks": [
        {
          "name": "mainnet-quote-refused",
          "ok": true,
          "detail": null
        },
        {
          "name": "mainnet-execute-refused",
          "ok": true,
          "detail": null
        }
      ],
      "proof_ids": [
        "proof:run:sample:036"
      ],
      "status": "PASS"
    },
    {
      "id": "54t-containment",
      "capability": "CONTAINMENT",
      "checks": [
        {
          "name": "refused-before-provider",
          "ok": true,
          "detail": null
        },
        {
          "name": "containment-state",
          "ok": true,
          "detail": null
        }
      ],
      "proof_ids": [
        "proof:run:sample:037",
        "proof:run:sample:038"
      ],
      "status": "PASS"
    },
    {
      "id": "capability-coverage",
      "capability": "DISCOVERY",
      "checks": [
        {
          "name": "declared-all-exercised",
          "ok": true,
          "detail": []
        },
        {
          "name": "exercised-all-declared",
          "ok": true,
          "detail": []
        }
      ],
      "proof_ids": [
        "proof:run:sample:039"
      ],
      "status": "PASS"
    }
  ],
  "proofs": [
    {
      "proof_id": "proof:run:sample:001",
      "proof_class": "ProofOfCapability",
      "agent_entity_ref": "agententity:harness-actor",
      "intent_ref": null,
      "mandate_ref": "mandate:harness-sandbox",
      "execution_envelope_ref": null,
      "evidence_refs": [
        "sha256:3ff4d06d2afce5fbb6209c8a39afc46a8103f1e8f73b4bd4206314054e9f62b8"
      ],
      "verifier_ref": "aquaduct-harness",
      "policy_version_ref": "policy:aquaduct-harness-v1",
      "security_attestation_ref": null,
      "created_at": "2026-01-01T00:00:00.000Z",